{
  "customer": "Northstar Bank",
  "commitment": "Customer workspace data, prompts, embeddings and agent logs remain within the EU processing boundary with no US model-provider failover.",
  "sourceDocument": "DPA Data Residency Rider, Section 2.1",
  "owner": "Infrastructure Lead",
  "productArea": "LLM gateway and retrieval layer",
  "operationalDependency": "EU-only model gateway route and disabled fallback to US inference endpoints",
  "renewalRelevance": true,
  "reviewDate": "2026-07-01",
  "currentStatus": "at_risk",
  "requiredAction": "Confirm failover behavior, support access scope and model-provider logging before renewal call."
}
